2012-05-09 11-52-32,594,Thorlabs
2012-05-09 13-26-10,522,Catalogue || Vector Core || Gene Therapy Program || University of Pennsylvania
2012-05-09 13-36-23,162,WPRE-mediated enhancement of gene expression is promoter and cell line specific
2012-05-10 09-47-10,426,Differential roles of ERK
2012-05-10 09-41-26,218,Emerging Gene Therapies for Retinal Degenerations
2012-05-11 13-56-22,140,Popular Insect Repellent Deet Is Neurotoxic -- ScienceDaily
2012-05-11 13-40-18,136,Popular Insect Repellent Deet Is Neurotoxic -- ScienceDaily
2012-06-06 09-48-07,44,正在为您加载，请稍候……
2012-06-06 09-55-50,42,ìáê?D??￠_?a?è?・2è・?_365ì?・?
2012-07-06 09-24-07,278,LASEC Online Ordering - User Authorisation
2012-07-07 09-16-26,246,超凡蜘蛛侠 (豆瓣)
2012-07-08 17-45-16,474,PLOS ONE:  All Subject Areas
2012-08-08 10-40-11,121,正在为您加载，请稍候……
2012-08-09 09-50-37,134,正在为您加载，请稍候……
2012-08-12 11-20-57,70,正在为您加载，请稍候……
